Date,Day,Time of Day,Short Notes
27-06-2025,Friday,Morning,Felt refreshed and ready to start the day
27-06-2025,Friday,Afternoon,Felt a bit tired after lunch but managed work well
27-06-2025,Friday,Evening,Felt productive and finished all tasks
27-06-2025,Friday,Night,Felt calm and grateful for the day
28-06-2025,Saturday,Morning,Felt a little stressed about upcoming meetings
28-06-2025,Saturday,Afternoon,Felt energized after a good meal
28-06-2025,Saturday,Evening,Felt accomplished after workout
28-06-2025,Saturday,Night,Felt relaxed while watching a movie
29-06-2025,Sunday,Morning,Felt motivated to complete assignments
29-06-2025,Sunday,Afternoon,Felt distracted but pushed through
29-06-2025,Sunday,Evening,Felt connected after catching up with friends
29-06-2025,Sunday,Night,Felt peaceful before sleep
30-06-2025,Monday,Morning,Felt lazy and wanted to stay in bed
30-06-2025,Monday,Afternoon,Felt focused and did quality work
30-06-2025,Monday,Evening,Felt a little overwhelmed with tasks
30-06-2025,Monday,Night,Felt better after journaling
01-07-2025,Tuesday,Morning,Felt happy about the weekend plans
01-07-2025,Tuesday,Afternoon,Felt social and had a good lunch with colleagues
01-07-2025,Tuesday,Evening,Felt relaxed while listening to music
01-07-2025,Tuesday,Night,Felt thankful for a good day
02-07-2025,Wednesday,Morning,Felt calm and enjoyed morning coffee
02-07-2025,Wednesday,Afternoon,Felt a little bored but stayed on track
02-07-2025,Wednesday,Evening,Felt energetic during evening walk
02-07-2025,Wednesday,Night,Felt sleepy but satisfied with the day
03-07-2025,Thursday,Morning,Felt fresh and ready for the week ahead
03-07-2025,Thursday,Afternoon,Felt slightly anxious but managed it
03-07-2025,Thursday,Evening,Felt joyful after spending time with family
03-07-2025,Thursday,Night,Felt content and excited for tomorrow
04-07-2025,Friday,Morning,Felt a bit low in the morning but gathered strength to start the day
04-07-2025,Friday,Afternoon,Felt a sudden rush of energy and focused on tasks
04-07-2025,Friday,Evening,Had a mix of random thoughts, laughed a bit while relaxing
04-07-2025,Friday,Night,Felt peaceful while reflecting on the day
05-07-2025,Saturday,Morning,Felt low but pushed myself to get moving
05-07-2025,Saturday,Afternoon,Felt excited and motivated after chatting with friends
05-07-2025,Saturday,Evening,Felt quiet and wanted some alone time
05-07-2025,Saturday,Night,Felt thoughtful while journaling before bed
06-07-2025,Sunday,Morning,Felt determined to make today productive
06-07-2025,Sunday,Afternoon,Felt cheerful after spending time with family
06-07-2025,Sunday,Evening,Felt calm and enjoyed some music
06-07-2025,Sunday,Night,Felt tired but grateful for the little wins today
07-07-2025,Monday,Morning,Felt slow and unmotivated to start the day
07-07-2025,Monday,Afternoon,Felt like zoning out but managed to stay present
07-07-2025,Monday,Evening,Felt low energy but got through my tasks
07-07-2025,Monday,Night,Felt happy after completing a long-pending task
08-07-2025,Tuesday,Morning,Felt fresh and optimistic about the day
08-07-2025,Tuesday,Afternoon,Felt calm and enjoyed a good lunch
08-07-2025,Tuesday,Evening,Felt energetic while finishing my projects
08-07-2025,Tuesday,Night,Felt cheerful and satisfied with my progress
09-07-2025,Wednesday,Morning,Felt peaceful while sipping morning tea
09-07-2025,Wednesday,Afternoon,Felt like taking a break but kept pushing
09-07-2025,Wednesday,Evening,Felt calm while spending time with loved ones
09-07-2025,Wednesday,Night,Felt a bit restless before falling asleep
10-07-2025,Thursday,Morning,Felt quiet and needed extra time to get moving
10-07-2025,Thursday,Afternoon,Felt energetic and finished most of my work early
10-07-2025,Thursday,Evening,Felt happy and relaxed after a nice walk
10-07-2025,Thursday,Night,Felt at peace and ready for tomorrow
11-07-2025,Friday,Morning,Felt a little sluggish but pushed myself to start
11-07-2025,Friday,Afternoon,Felt engaged and completed important tasks
11-07-2025,Friday,Evening,Felt joyful after catching up with an old friend
11-07-2025,Friday,Night,Felt content and relaxed before bed
12-07-2025,Saturday,Morning,Felt energized and ready for a fun day
12-07-2025,Saturday,Afternoon,Felt adventurous exploring new places
12-07-2025,Saturday,Evening,Felt calm and enjoyed a nice dinner
12-07-2025,Saturday,Night,Felt sleepy and satisfied with the day
13-07-2025,Sunday,Morning,Felt motivated to try something creative
13-07-2025,Sunday,Afternoon,Felt productive while working on personal goals
13-07-2025,Sunday,Evening,Felt happy spending time with family
13-07-2025,Sunday,Night,Felt peaceful and ready for the new week
14-07-2025,Monday,Morning,Felt slow but managed to get moving
14-07-2025,Monday,Afternoon,Felt focused and handled work well
14-07-2025,Monday,Evening,Felt a bit drained but proud of my effort
14-07-2025,Monday,Night,Felt calm while reading before bed
15-07-2025,Tuesday,Morning,Felt fresh and excited about the day
15-07-2025,Tuesday,Afternoon,Felt productive and met deadlines
15-07-2025,Tuesday,Evening,Felt cheerful during a video call with friends
15-07-2025,Tuesday,Night,Felt grateful for today’s moments
16-07-2025,Wednesday,Morning,Felt rested and positive about the day
16-07-2025,Wednesday,Afternoon,Felt a bit overwhelmed but managed it
16-07-2025,Wednesday,Evening,Felt happy after a good workout
16-07-2025,Wednesday,Night,Felt thoughtful while journaling
17-07-2025,Thursday,Morning,Felt slow but determined to stay productive
17-07-2025,Thursday,Afternoon,Felt energetic and completed pending tasks
17-07-2025,Thursday,Evening,Felt peaceful while listening to soft music
17-07-2025,Thursday,Night,Felt calm and ready for tomorrow
18-07-2025,Friday,Morning,Felt excited for the weekend
18-07-2025,Friday,Afternoon,Felt focused during meetings
18-07-2025,Friday,Evening,Felt relaxed while enjoying a movie
18-07-2025,Friday,Night,Felt happy about today’s small wins
19-07-2025,Saturday,Morning,Felt calm and ready for a relaxed day
19-07-2025,Saturday,Afternoon,Felt joyful exploring hobbies
19-07-2025,Saturday,Evening,Felt peaceful while spending time outdoors
19-07-2025,Saturday,Night,Felt content reflecting on the day
20-07-2025,Sunday,Morning,Felt fresh and motivated for the week ahead
20-07-2025,Sunday,Afternoon,Felt grateful for time with loved ones
20-07-2025,Sunday,Evening,Felt calm while reading a book
20-07-2025,Sunday,Night,Felt relaxed and ready for tomorrow
21-07-2025,Monday,Morning,Felt a bit tired but managed to start strong
21-07-2025,Monday,Afternoon,Felt productive and got things done
21-07-2025,Monday,Evening,Felt calm and connected after catching up with friends
21-07-2025,Monday,Night,Felt peaceful while winding down
22-07-2025,Tuesday,Morning,Felt fresh and ready to tackle tasks
22-07-2025,Tuesday,Afternoon,Felt engaged and made good progress
22-07-2025,Tuesday,Evening,Felt cheerful while spending time with family
22-07-2025,Tuesday,Night,Felt satisfied with today’s effort
23-07-2025,Wednesday,Morning,Felt focused and had a smooth start
23-07-2025,Wednesday,Afternoon,Felt slightly distracted but managed tasks
23-07-2025,Wednesday,Evening,Felt happy while watching my favorite show
23-07-2025,Wednesday,Night,Felt thankful for the calm moments today
24-07-2025,Thursday,Morning,Felt a bit lazy but motivated myself to get going
24-07-2025,Thursday,Afternoon,Felt productive and managed work well
24-07-2025,Thursday,Evening,Felt peaceful while listening to music
24-07-2025,Thursday,Night,Felt happy about completing key tasks
25-07-2025,Friday,Morning,Felt excited and ready for the weekend
25-07-2025,Friday,Afternoon,Felt social and enjoyed working with friends
25-07-2025,Friday,Evening,Felt joyful while watching a movie
25-07-2025,Friday,Night,Felt content and peaceful before sleep
26-07-2025,Saturday,Morning,Felt calm and ready for a relaxing day
26-07-2025,Saturday,Afternoon,Felt cheerful while trying new activities
26-07-2025,Saturday,Evening,Felt relaxed after a fun evening out
26-07-2025,Saturday,Night,Felt peaceful reflecting on happy memories
27-07-2025,Sunday,Morning,Felt fresh and excited to plan the week
27-07-2025,Sunday,Afternoon,Felt productive while preparing for the next day
27-07-2025,Sunday,Evening,Felt calm while spending quality time with family
27-07-2025,Sunday,Night,Felt grateful for a peaceful weekend
28-07-2025,Monday,Morning,Felt motivated to start strong
28-07-2025,Monday,Afternoon,Felt busy but handled tasks well
28-07-2025,Monday,Evening,Felt calm after completing a tough day
28-07-2025,Monday,Night,Felt satisfied with today’s efforts
29-07-2025,Tuesday,Morning,Felt refreshed and eager to work
29-07-2025,Tuesday,Afternoon,Felt focused and productive
29-07-2025,Tuesday,Evening,Felt happy after meeting friends
29-07-2025,Tuesday,Night,Felt peaceful while journaling
30-07-2025,Wednesday,Morning,Felt calm and ready for the day
30-07-2025,Wednesday,Afternoon,Felt motivated and finished work efficiently
30-07-2025,Wednesday,Evening,Felt relaxed while enjoying my hobbies
30-07-2025,Wednesday,Night,Felt grateful for today’s good moments
31-07-2025,Thursday,Morning,Felt peaceful and excited about the new month ahead
31-07-2025,Thursday,Afternoon,Felt productive and wrapped up important work
31-07-2025,Thursday,Evening,Felt happy while spending time with family
31-07-2025,Thursday,Night,Felt content and thankful for the journey so far